{
  "schemaVersion":"0.1.0","kind":"geck-authoring-intent","id":"io.wastelandforge.geckplanexample.authoring",
  "plugin":{"fileName":"CouriersEmergencyCache.esp","author":"Synthetic Fixture","summary":"Preview-only synthetic plan.","masters":["FalloutNV.esm"]},
  "environment":{"mode":"physical-data","outputRoot":"staging/Data","providers":[
    {"role":"geck","path":"evidence/local.txt","length":25,"sha256":"53ffdbf57b32352938afa292b87dac5044f92b784c083513d549beeffc2b330b","status":"local-verified"},
    {"role":"authoring-provider","path":"evidence/local.txt","length":25,"sha256":"53ffdbf57b32352938afa292b87dac5044f92b784c083513d549beeffc2b330b","status":"local-verified"},
    {"role":"xedit-verifier","path":"evidence/local.txt","length":25,"sha256":"53ffdbf57b32352938afa292b87dac5044f92b784c083513d549beeffc2b330b","status":"local-verified"}
  ]},
  "resolutions":[
    {"id":"io.fixture.water","kind":"item","editorId":"WaterPurified","formId":"000151A3","signature":"ALCH","status":"local-verified","evidence":{"path":"evidence/local.txt","length":25,"sha256":"53ffdbf57b32352938afa292b87dac5044f92b784c083513d549beeffc2b330b"}},
    {"id":"io.fixture.caps","kind":"item","editorId":"Caps001","formId":"0000000F","signature":"MISC","status":"local-verified","evidence":{"path":"evidence/local.txt","length":25,"sha256":"53ffdbf57b32352938afa292b87dac5044f92b784c083513d549beeffc2b330b"}},
    {"id":"io.fixture.cell","kind":"cell","editorId":"SyntheticExterior","formId":"00000001","signature":"CELL","status":"local-verified","evidence":{"path":"evidence/local.txt","length":25,"sha256":"53ffdbf57b32352938afa292b87dac5044f92b784c083513d549beeffc2b330b"}},
    {"id":"io.fixture.base","kind":"container-base","editorId":"SyntheticContainerBase","formId":"00000002","signature":"CONT","status":"local-verified","evidence":{"path":"evidence/local.txt","length":25,"sha256":"53ffdbf57b32352938afa292b87dac5044f92b784c083513d549beeffc2b330b"}}
  ],
  "container":{"id":"io.fixture.container","editorId":"CourierEmergencyCache","strategy":"new","respawns":false,"items":[{"resolutionId":"io.fixture.water","quantity":5},{"resolutionId":"io.fixture.caps","quantity":5000}]},
  "reference":{"id":"io.fixture.reference","editorId":"CourierEmergencyCacheRef","cellResolutionId":"io.fixture.cell","baseContainerId":"io.fixture.container","position":{"x":1,"y":2,"z":3},"rotation":{"x":0,"y":0,"z":90},"ownership":"unowned","persistent":false,"encounterZonePolicy":"inherit-cell"}
}
